SELECT * FROM query_parameterization_views();
 databaseid | query_type | is_bypass | param_types | param_nums | parameterized_query 
------------+------------+-----------+-------------+------------+---------------------
(0 rows)

set enable_query_parameterization=on;
CREATE TABLE test(c1 INT, c2 INT);
INSERT INTO test(C1, C2) VALUES(1, 1);
-- count should be 1
SELECT COUNT(*) FROM query_parameterization_views();
 count 
-------
     1
(1 row)

DROP TABLE test;
CREATE TABLE test(c1 INT, c2 INT);
-- count should be 0
SELECT COUNT(*) FROM query_parameterization_views();
 count 
-------
     0
(1 row)

INSERT INTO test(C1, C2) VALUES(2, 3);
INSERT INTO test(C1, C2) VALUES(3, 4);
-- only 1 insert record
SELECT query_type, is_bypass, param_types, param_nums, parameterized_query FROM query_parameterization_views();
 query_type | is_bypass | param_types | param_nums |          parameterized_query           
------------+-----------+-------------+------------+----------------------------------------
 INSERT     | t         | 23 23       |          2 | INSERT INTO test(C1, C2) VALUES(?, ?);
(1 row)

set enable_query_parameterization=off;
-- count should be 1
SELECT COUNT(*) FROM query_parameterization_views();
 count 
-------
     1
(1 row)

set enable_query_parameterization=on;
UPDATE test SET C1 = 100 WHERE C1 = 3;
-- 2 records, insert & update
SELECT query_type, is_bypass, param_types, param_nums, parameterized_query FROM query_parameterization_views();
 query_type | is_bypass | param_types | param_nums |          parameterized_query           
------------+-----------+-------------+------------+----------------------------------------
 UPDATE     | f         | 23 23       |          2 | UPDATE test SET C1 = ? WHERE C1 = ?;
 INSERT     | t         | 23 23       |          2 | INSERT INTO test(C1, C2) VALUES(?, ?);
(2 rows)

DELETE FROM test where C1 = 3;
-- 3 records
SELECT query_type, is_bypass, param_types, param_nums, parameterized_query FROM query_parameterization_views();
 query_type | is_bypass | param_types | param_nums |          parameterized_query           
------------+-----------+-------------+------------+----------------------------------------
 UPDATE     | f         | 23 23       |          2 | UPDATE test SET C1 = ? WHERE C1 = ?;
 INSERT     | t         | 23 23       |          2 | INSERT INTO test(C1, C2) VALUES(?, ?);
 DELETE     | f         | 23          |          1 | DELETE FROM test where C1 = ?;
(3 rows)

ALTER TABLE test DROP COLUMN C2;
-- no record left 
SELECT query_type, is_bypass, param_types, param_nums, parameterized_query FROM query_parameterization_views();
 query_type | is_bypass | param_types | param_nums | parameterized_query 
------------+-----------+-------------+------------+---------------------
(0 rows)

DROP TABLE test;
CREATE TABLE test1(id int, column1 int, column2 int, column3 int, column4 int, column5 int, column6 int, column7 int, column8 int, column9 int, column10 int);
INSERT INTO test1(id, column1, column2, column3, column4, column5, column6, column7, column8, column9, column10) VALUES(1, 2, 3, 4, 5, 6, 7, 8, 9, 10, 11);
SELECT query_type, is_bypass, param_types, param_nums, parameterized_query FROM query_parameterization_views();
 query_type | is_bypass |           param_types            | param_nums |                                                                    parameterized_query                                                                    
------------+-----------+----------------------------------+------------+-----------------------------------------------------------------------------------------------------------------------------------------------------------
 INSERT     | t         | 23 23 23 23 23 23 23 23 23 23 23 |         11 | INSERT INTO test1(id, column1, column2, column3, column4, column5, column6, column7, column8, column9, column10) VALUES(?, ?, ?, ?, ?, ?, ?, ?, ?, ?, ?);
(1 row)

DROP TABLE test1;
-- Support select with where clause
CREATE TABLE test2(c1 INT, c2 INT);
SELECT query_type, is_bypass, param_types, param_nums, parameterized_query FROM query_parameterization_views();
 query_type | is_bypass | param_types | param_nums | parameterized_query 
------------+-----------+-------------+------------+---------------------
(0 rows)

INSERT INTO test2(c1, c2) VALUES(1, 1);
INSERT INTO test2(c1, c2) VALUES(1, 2);
INSERT INTO test2(c1, c2) VALUES(2, 2);
SELECT query_type, is_bypass, param_types, param_nums, parameterized_query FROM query_parameterization_views();
 query_type | is_bypass | param_types | param_nums |           parameterized_query           
------------+-----------+-------------+------------+-----------------------------------------
 INSERT     | t         | 23 23       |          2 | INSERT INTO test2(c1, c2) VALUES(?, ?);
(1 row)

SELECT * FROM test2;
 c1 | c2 
----+----
  1 |  1
  1 |  2
  2 |  2
(3 rows)

SELECT query_type, is_bypass, param_types, param_nums, parameterized_query FROM query_parameterization_views();
 query_type | is_bypass | param_types | param_nums |           parameterized_query           
------------+-----------+-------------+------------+-----------------------------------------
 INSERT     | t         | 23 23       |          2 | INSERT INTO test2(c1, c2) VALUES(?, ?);
(1 row)

SELECT * FROM test2 WHERE c1 = 1;
 c1 | c2 
----+----
  1 |  1
  1 |  2
(2 rows)

SELECT query_type, is_bypass, param_types, param_nums, parameterized_query FROM query_parameterization_views();
 query_type | is_bypass | param_types | param_nums |           parameterized_query           
------------+-----------+-------------+------------+-----------------------------------------
 SELECT     | f         | 23          |          1 | SELECT * FROM test2 WHERE c1 = ?;
 INSERT     | t         | 23 23       |          2 | INSERT INTO test2(c1, c2) VALUES(?, ?);
(2 rows)

SELECT * FROM test2 WHERE c1 = 1 and c2 = 2;
 c1 | c2 
----+----
  1 |  2
(1 row)

SELECT query_type, is_bypass, param_types, param_nums, parameterized_query FROM query_parameterization_views();
 query_type | is_bypass | param_types | param_nums |             parameterized_query              
------------+-----------+-------------+------------+----------------------------------------------
 SELECT     | f         | 23          |          1 | SELECT * FROM test2 WHERE c1 = ?;
 INSERT     | t         | 23 23       |          2 | INSERT INTO test2(c1, c2) VALUES(?, ?);
 SELECT     | f         | 23 23       |          2 | SELECT * FROM test2 WHERE c1 = ? and c2 = ?;
(3 rows)

SELECT * FROM test2 WHERE c1 = 1 or c2 = 2;
 c1 | c2 
----+----
  1 |  1
  1 |  2
  2 |  2
(3 rows)

SELECT query_type, is_bypass, param_types, param_nums, parameterized_query FROM query_parameterization_views();
 query_type | is_bypass | param_types | param_nums |             parameterized_query              
------------+-----------+-------------+------------+----------------------------------------------
 SELECT     | f         | 23          |          1 | SELECT * FROM test2 WHERE c1 = ?;
 SELECT     | f         | 23 23       |          2 | SELECT * FROM test2 WHERE c1 = ? or c2 = ?;
 INSERT     | t         | 23 23       |          2 | INSERT INTO test2(c1, c2) VALUES(?, ?);
 SELECT     | f         | 23 23       |          2 | SELECT * FROM test2 WHERE c1 = ? and c2 = ?;
(4 rows)

-- Do not support other clauses
SELECT * FROM test2 WHERE c1 = 1 ORDER BY c2 ASC;
 c1 | c2 
----+----
  1 |  1
  1 |  2
(2 rows)

SELECT query_type, is_bypass, param_types, param_nums, parameterized_query FROM query_parameterization_views();
 query_type | is_bypass | param_types | param_nums |             parameterized_query              
------------+-----------+-------------+------------+----------------------------------------------
 SELECT     | f         | 23          |          1 | SELECT * FROM test2 WHERE c1 = ?;
 SELECT     | f         | 23 23       |          2 | SELECT * FROM test2 WHERE c1 = ? or c2 = ?;
 INSERT     | t         | 23 23       |          2 | INSERT INTO test2(c1, c2) VALUES(?, ?);
 SELECT     | f         | 23 23       |          2 | SELECT * FROM test2 WHERE c1 = ? and c2 = ?;
(4 rows)

SELECT * FROM test2 WHERE c1 = 1 LIMIT 1;
 c1 | c2 
----+----
  1 |  1
(1 row)

SELECT query_type, is_bypass, param_types, param_nums, parameterized_query FROM query_parameterization_views();
 query_type | is_bypass | param_types | param_nums |             parameterized_query              
------------+-----------+-------------+------------+----------------------------------------------
 SELECT     | f         | 23          |          1 | SELECT * FROM test2 WHERE c1 = ?;
 SELECT     | f         | 23 23       |          2 | SELECT * FROM test2 WHERE c1 = ? or c2 = ?;
 INSERT     | t         | 23 23       |          2 | INSERT INTO test2(c1, c2) VALUES(?, ?);
 SELECT     | f         | 23 23       |          2 | SELECT * FROM test2 WHERE c1 = ? and c2 = ?;
(4 rows)

DROP table test2;
drop table if exists my_table;
NOTICE:  table "my_table" does not exist, skipping
CREATE TABLE my_table (
    c1 INT,
    c2 INT,
    c3 INT,
    c4 CHAR(1)
) with (compresstype=2);
INSERT INTO my_table (c1, c2, c3, c4) VALUES (1, 10, 100, 'A'), (2, 20, 200, 'B'), (3, 30, 300, 'C'), (4, 40, 400, 'D'), (5, 50, 500, 'E');
select c1 from my_table where c2>20;
 c1 
----
  3
  4
  5
(3 rows)

SELECT * FROM query_parameterization_views();
 databaseid | query_type | is_bypass | param_types | param_nums | parameterized_query 
------------+------------+-----------+-------------+------------+---------------------
(0 rows)

set enable_query_parameterization=off;
